id,title,description,number_of_players,play_time,age_recommendation,complexity,year_released,more_info,official_page
1,"Monopoly","a great way to lose friends",4,120,10,4,1950,null,null
2,"Settlers of Catan","another great way to lose friends",4,1000,10,4,1975,null,null
3,"Settlers of Catan: Knights Edition","another great way to lose friends, but with knights this time",4,60,10,4,1980,null,null
4,"Code Names","yell at your friends",4,120,10,4,2000,null,null
5,"Risk","a great way to spend 10 hours of your life and lose friends",4,999999,16,20,1965,null,null